{
  "schemaVersion": 1,
  "id": "first-time-recorder",
  "name": "처음 운동을 기록하는 사용자",
  "experience": "first-time",
  "context": "운동은 해 봤지만 GymNote는 처음 사용한다. 조용한 장소에서 현재 화면의 짧은 문구를 읽으며 기록을 남기려 한다.",
  "goals": [
    "실제로 수행한 운동과 예정된 운동을 구분하고 싶다.",
    "저장된 내용이 무엇인지 알고 싶다."
  ],
  "attention": "normal",
  "readingStyle": "brief",
  "synthetic": true
}
