{
  "schemaVersion": 1,
  "id": "distracted-exerciser",
  "name": "운동 중 주의가 분산된 사용자",
  "experience": "returning",
  "context": "운동 사이에 잠깐 화면을 확인한다. 주변 대화와 휴식 때문에 주의가 끊기며 이전 화면을 오래 기억하지 못한다.",
  "goals": [
    "실제 반복 횟수를 빠뜨리지 않고 남기고 싶다.",
    "같은 세트를 두 번 완료 처리하지 않고 운동을 이어가고 싶다."
  ],
  "attention": "distracted",
  "readingStyle": "brief",
  "synthetic": true
}
